Cites,Authors,Title,Year,Source,Publisher,ArticleURL,CitesURL,GSRank,QueryDate,Type,DOI,ISSN,CitationURL,Volume,Issue,StartPage,EndPage,ECC,CitesPerYear,CitesPerAuthor,AuthorCount,Age,Abstract,FullTextURL,RelatedURL
0,"S.S. Ahmad","Centralized smart energy monitoring system for legacy home appliances",2024,"Energy Informatics","","","https://www.scopus.com/inward/citedby.uri?partnerID=HzOxMe3b&scp=85191082898&origin=inward",15,"2024-06-23 23:05:33","Article","10.1186/s42162-024-00334-2","2520-8942","https://api.elsevier.com/content/abstract/scopus_id/85191082898",7,1,,,0,0.00,0,1,1,"","",""
0,"F. Qayyum","Wildfire risk exploration: leveraging SHAP and TabNet for precise factor analysis",2024,"Fire Ecology","","","https://www.scopus.com/inward/citedby.uri?partnerID=HzOxMe3b&scp=85183369763&origin=inward",16,"2024-06-23 23:05:33","Article","10.1186/s42408-023-00236-w","1933-9747","https://api.elsevier.com/content/abstract/scopus_id/85183369763",20,1,,,0,0.00,0,1,1,"","",""
0,"F. Qayyum","Shapley-based interpretation of deep learning models for wildfire spread rate prediction",2024,"Fire Ecology","","","https://www.scopus.com/inward/citedby.uri?partnerID=HzOxMe3b&scp=85182999643&origin=inward",17,"2024-06-23 23:05:33","Article","10.1186/s42408-023-00242-y","1933-9747","https://api.elsevier.com/content/abstract/scopus_id/85182999643",20,1,,,0,0.00,0,1,1,"","",""
0,"R.R. Bashir","2CAP: A Novel Curve Crash Avoidance Protocol to Handle Curve Crashes in Vehicular Ad-Hoc Network",2024,"IEEE Access","","","https://www.scopus.com/inward/citedby.uri?partnerID=HzOxMe3b&scp=85181562022&origin=inward",18,"2024-06-23 23:05:33","Article","10.1109/ACCESS.2024.3349474","2169-3536","https://api.elsevier.com/content/abstract/scopus_id/85181562022",12,,60601,60619,0,0.00,0,1,1,"","",""
8,"M. Hijjawi","Accelerated Arithmetic Optimization Algorithm by Cuckoo Search for Solving Engineering Design Problems",2023,"Processes","","","https://www.scopus.com/inward/citedby.uri?partnerID=HzOxMe3b&scp=85160938621&origin=inward",4,"2024-06-23 23:05:33","Article","10.3390/pr11051380","2227-9717","https://api.elsevier.com/content/abstract/scopus_id/85160938621",11,5,,,8,8.00,8,1,1,"","",""
8,"I. Mashal","The determinants of reliable smart grid from experts’ perspective",2023,"Energy Informatics","","","https://www.scopus.com/inward/citedby.uri?partnerID=HzOxMe3b&scp=85152522486&origin=inward",5,"2024-06-23 23:05:33","Article","10.1186/s42162-023-00266-3","2520-8942","https://api.elsevier.com/content/abstract/scopus_id/85152522486",6,1,,,8,8.00,8,1,1,"","",""
3,"M. Hijjawi","Improved flat mobile core network architecture for 5G mobile communication systems",2023,"International Journal of Data and Network Science","","","https://www.scopus.com/inward/citedby.uri?partnerID=HzOxMe3b&scp=85162811902&origin=inward",8,"2024-06-23 23:05:33","Article","10.5267/j.ijdns.2023.3.021","2561-8148","https://api.elsevier.com/content/abstract/scopus_id/85162811902",7,3,1421,1434,3,3.00,3,1,1,"","",""
2,"M. Alkayed","Factors Analysis Affecting Academic Achievement of Undergraduate Student: A study on Faculty of Information Technology Students at Applied Science Private University",2023,"2nd International Conference on Business Analytics for Technology and Security, ICBATS 2023","","","https://www.scopus.com/inward/citedby.uri?partnerID=HzOxMe3b&scp=85160721003&origin=inward",11,"2024-06-23 23:05:33","Conference Paper","10.1109/ICBATS57792.2023.10111100","","https://api.elsevier.com/content/abstract/scopus_id/85160721003",,,,,2,2.00,2,1,1,"","",""
1,"M. Hijjawi","A Novel Hybrid Prairie Dog Algorithm and Harris Hawks Algorithm for Resource Allocation of Wireless Networks",2023,"IEEE Access","","","https://www.scopus.com/inward/citedby.uri?partnerID=HzOxMe3b&scp=85181584131&origin=inward",13,"2024-06-23 23:05:33","Article","10.1109/ACCESS.2023.3335247","2169-3536","https://api.elsevier.com/content/abstract/scopus_id/85181584131",11,,145146,145166,1,1.00,1,1,1,"","",""
0,"T. Alsboui","A Scalable Decentralized and Lightweight Access Control Framework Using IOTA Tangle for the Internet of Things",2023,"International Conference on Internet of Things, Big Data and Security, IoTBDS - Proceedings","","","https://www.scopus.com/inward/citedby.uri?partnerID=HzOxMe3b&scp=85160778585&origin=inward",19,"2024-06-23 23:05:33","Conference Paper","10.5220/0011963600003482","2184-4976","https://api.elsevier.com/content/abstract/scopus_id/85160778585",2023,,178,185,0,0.00,0,1,1,"","",""
3,"M. Aljanabi","Comparison of multiple machine learning algorithms for urban air quality forecasting",2021,"Periodicals of Engineering and Natural Sciences","","","https://www.scopus.com/inward/citedby.uri?partnerID=HzOxMe3b&scp=85121838920&origin=inward",9,"2024-06-23 23:05:33","Article","10.21533/pen.v9i4.2477","2303-4521","https://api.elsevier.com/content/abstract/scopus_id/85121838920",9,4,1013,1028,3,1.00,3,1,3,"","",""
31,"M. Aljanabi","Ground-level Ozone Prediction Using Machine Learning Techniques: A Case Study in Amman, Jordan",2020,"International Journal of Automation and Computing","","","https://www.scopus.com/inward/citedby.uri?partnerID=HzOxMe3b&scp=85085572219&origin=inward",1,"2024-06-23 23:05:33","Article","10.1007/s11633-020-1233-4","1476-8186","https://api.elsevier.com/content/abstract/scopus_id/85085572219",17,5,667,677,31,7.75,31,1,4,"","",""
2,"M. Majthoub","Non-Functional Requirements Classification for Aligning Business with Information Systems",2020,"ACM International Conference Proceeding Series","","","https://www.scopus.com/inward/citedby.uri?partnerID=HzOxMe3b&scp=85099066969&origin=inward",12,"2024-06-23 23:05:33","Conference Paper","10.1145/3437075.3437091","","https://api.elsevier.com/content/abstract/scopus_id/85099066969",,,84,89,2,0.50,2,1,4,"","",""
8,"A. Ai-Sakran","A proposed performance evaluation of NoSQL databases in the field of IoT",2018,"2018 8th International Conference on Computer Science and Information Technology, CSIT 2018","","","https://www.scopus.com/inward/citedby.uri?partnerID=HzOxMe3b&scp=85056703412&origin=inward",6,"2024-06-23 23:05:33","Conference Paper","10.1109/CSIT.2018.8486199","","https://api.elsevier.com/content/abstract/scopus_id/85056703412",,,32,37,8,1.33,8,1,6,"","",""
5,"A. Al-Sakran","An Overview of the Internet of Things Closed Source Operating Systems",2018,"2018 14th International Wireless Communications and Mobile Computing Conference, IWCMC 2018","","","https://www.scopus.com/inward/citedby.uri?partnerID=HzOxMe3b&scp=85053932965&origin=inward",7,"2024-06-23 23:05:33","Conference Paper","10.1109/IWCMC.2018.8450314","","https://api.elsevier.com/content/abstract/scopus_id/85053932965",,,291,297,5,0.83,5,1,6,"","",""
1,"M. Azzeh","Online reputation model using multiple quality factors",2018,"International Journal on Advanced Science, Engineering and Information Technology","","","https://www.scopus.com/inward/citedby.uri?partnerID=HzOxMe3b&scp=85059508526&origin=inward",14,"2024-06-23 23:05:33","Article","10.18517/ijaseit.8.6.6259","2088-5334","https://api.elsevier.com/content/abstract/scopus_id/85059508526",8,6,2612,2619,1,0.17,1,1,6,"","",""
0,"M. Hijjawi","Preface",2016,"Proceedings - CSIT 2016: 2016 7th International Conference on Computer Science and Information Technology","","","https://www.scopus.com/inward/citedby.uri?partnerID=HzOxMe3b&scp=84987664774&origin=inward",20,"2024-06-23 23:05:33","Editorial","10.1109/CSIT.2016.7549438","","https://api.elsevier.com/content/abstract/scopus_id/84987664774",,,,,0,0.00,0,1,8,"","",""
21,"M. Hijjawi","ArabChat: An arabic conversational agent",2014,"2014 6th International Conference on Computer Science and Information Technology, CSIT 2014 - Proceedings","","","https://www.scopus.com/inward/citedby.uri?partnerID=HzOxMe3b&scp=84901238245&origin=inward",2,"2024-06-23 23:05:33","Conference Paper","10.1109/CSIT.2014.6806005","","https://api.elsevier.com/content/abstract/scopus_id/84901238245",,,227,237,21,2.10,21,1,10,"","",""
14,"M. Hijjawi","User's utterance classification using machine learning for Arabic Conversational Agents",2013,"2013 5th International Conference on Computer Science and Information Technology, CSIT 2013 - Proceedings","","","https://www.scopus.com/inward/citedby.uri?partnerID=HzOxMe3b&scp=84884886580&origin=inward",3,"2024-06-23 23:05:33","Conference Paper","10.1109/CSIT.2013.6588784","","https://api.elsevier.com/content/abstract/scopus_id/84884886580",,,223,232,14,1.27,14,1,11,"","",""
3,"M. Hijjawi","An application of pattern matching stemmer in Arabic dialogue system",2011,"Lecture Notes in Computer Science (including subseries Lecture Notes in Artificial Intelligence and Lecture Notes in Bioinformatics)","","","https://www.scopus.com/inward/citedby.uri?partnerID=HzOxMe3b&scp=79960305722&origin=inward",10,"2024-06-23 23:05:33","Conference Paper","10.1007/978-3-642-22000-5_5","0302-9743","https://api.elsevier.com/content/abstract/scopus_id/79960305722",6682,,35,43,3,0.23,3,1,13,"","",""
