Cites,Authors,Title,Year,Source,Publisher,ArticleURL,CitesURL,GSRank,QueryDate,Type,DOI,ISSN,CitationURL,Volume,Issue,StartPage,EndPage,ECC,CitesPerYear,CitesPerAuthor,AuthorCount,Age,Abstract,FullTextURL,RelatedURL
0,"I.M. Batiha","DC Motor Speed Control via Fractional-Order PID Controllers",2024,"International Journal of Fuzzy Logic and Intelligent Systems","","","https://www.scopus.com/inward/citedby.uri?partnerID=HzOxMe3b&scp=85190300703&origin=inward",7,"2024-06-23 22:47:02","Article","10.5391/IJFIS.2024.24.1.74","1598-2645","https://api.elsevier.com/content/abstract/scopus_id/85190300703",24,1,74,82,0,0.00,0,1,1,"","",""
5,"I.M. Batiha","Optimal design of PI<sup>ρ</sup>D<sup>µ</sup>-controller for artificial ventilation systems for COVID-19 patients",2023,"AIMS Mathematics","","","https://www.scopus.com/inward/citedby.uri?partnerID=HzOxMe3b&scp=85139260622&origin=inward",2,"2024-06-23 22:47:02","Article","10.3934/math.2023031","2473-6988","https://api.elsevier.com/content/abstract/scopus_id/85139260622",8,1,657,675,5,5.00,5,1,1,"","",""
21,"I.M. Batiha","Design Fractional-order PID Controllers for Single-Joint Robot Arm Model",2022,"International Journal of Advances in Soft Computing and its Applications","","","https://www.scopus.com/inward/citedby.uri?partnerID=HzOxMe3b&scp=85134640728&origin=inward",1,"2024-06-23 22:47:02","Article","10.15849/IJASCA.220720.07","2074-8523","https://api.elsevier.com/content/abstract/scopus_id/85134640728",14,2,96,114,21,10.50,21,1,2,"","",""
3,"R.M. Batyha","Cyclostationary Algorithm for Signal Analysis in Cognitive 4G Networks with Spectral Sensing and Resource Allocation",2022,"International Journal of Communication Networks and Information Security","","","https://www.scopus.com/inward/citedby.uri?partnerID=HzOxMe3b&scp=85147153976&origin=inward",3,"2024-06-23 22:47:02","Article","10.17762/ijcnis.v14i3.5570","2076-0930","https://api.elsevier.com/content/abstract/scopus_id/85147153976",14,3,47,58,3,1.50,3,1,2,"","",""
0,"R.M. Batyha","DATA MINING-BASED MULTIDIMENSIONAL EXTRACTION METHOD FOR INDICATORS OF SOCIAL SECURITY SYSTEM FOR PEOPLE WITH DISABILITIES",2022,"Journal of Applied Mathematics and Informatics","","","https://www.scopus.com/inward/citedby.uri?partnerID=HzOxMe3b&scp=85127284080&origin=inward",8,"2024-06-23 22:47:02","Article","10.14317/jami.2022.289","2734-1194","https://api.elsevier.com/content/abstract/scopus_id/85127284080",40,1,289,303,0,0.00,0,1,2,"","",""
3,"R.M. Batyha","Optimal design of fractional-order PID controllers using bacterial foraging optimization algorithm",2021,"International Journal of Advances in Soft Computing and its Applications","","","https://www.scopus.com/inward/citedby.uri?partnerID=HzOxMe3b&scp=85103483569&origin=inward",4,"2024-06-23 22:47:02","Article","","2074-8523","https://api.elsevier.com/content/abstract/scopus_id/85103483569",13,1,208,227,3,1.00,3,1,3,"","",""
0,"R.M. Batyha","Difficulties faced and applications of machine learning in cyber-security",2021,"International Journal of Advances in Soft Computing and its Applications","","","https://www.scopus.com/inward/citedby.uri?partnerID=HzOxMe3b&scp=85111422394&origin=inward",9,"2024-06-23 22:47:02","Article","","2074-8523","https://api.elsevier.com/content/abstract/scopus_id/85111422394",13,2,162,172,0,0.00,0,1,3,"","",""
2,"Q.Q. Abuein","A framework for social media and text-based content analysis for event management purposes",2016,"International Review on Computers and Software","","","https://www.scopus.com/inward/citedby.uri?partnerID=HzOxMe3b&scp=84979297898&origin=inward",5,"2024-06-23 22:47:02","Article","10.15866/irecos.v11i5.8694","1828-6003","https://api.elsevier.com/content/abstract/scopus_id/84979297898",11,5,388,394,2,0.25,2,1,8,"","",""
1,"Q.Q. Abuein","Expanded grammar for detecting equivalence in math expressions",2009,"2009 3rd IEEE International Conference on Digital Ecosystems and Technologies, DEST '09","","","https://www.scopus.com/inward/citedby.uri?partnerID=HzOxMe3b&scp=71649105230&origin=inward",6,"2024-06-23 22:47:02","Conference Paper","10.1109/DEST.2009.5276728","","https://api.elsevier.com/content/abstract/scopus_id/71649105230",,,575,580,1,0.07,1,1,15,"","",""
