Cites,Authors,Title,Year,Source,Publisher,ArticleURL,CitesURL,GSRank,QueryDate,Type,DOI,ISSN,CitationURL,Volume,Issue,StartPage,EndPage,ECC,CitesPerYear,CitesPerAuthor,AuthorCount,Age,Abstract,FullTextURL,RelatedURL
5,"J. Serrano-Guerrero","Combining machine learning algorithms for personality trait prediction",2024,"Egyptian Informatics Journal","","https://api.elsevier.com/content/article/eid/1-s2.0-S1110866524000021","https://www.scopus.com/inward/citedby.uri?partnerID=HzOxMe3b&scp=85184080756&origin=inward",1,"2024-06-23 22:52:58","Article","10.1016/j.eij.2024.100439","1110-8665","https://api.elsevier.com/content/abstract/scopus_id/85184080756",25,,,,5,5.00,5,1,1,"","",""
1,"B. Alshouha","What is the Consumer Attitude toward Healthcare Services? A Transfer Learning Approach for Detecting Emotions from Consumer Feedback",2024,"Journal of Universal Computer Science","","","https://www.scopus.com/inward/citedby.uri?partnerID=HzOxMe3b&scp=85185841335&origin=inward",2,"2024-06-23 22:52:58","Article","10.3897/jucs.104093","0948-695X","https://api.elsevier.com/content/abstract/scopus_id/85185841335",30,1,3,24,1,1.00,1,1,1,"","",""
1,"B. Alshouha","Personality trait detection via transfer learning",2024,"Computers, Materials and Continua","","","https://www.scopus.com/inward/citedby.uri?partnerID=HzOxMe3b&scp=85185834102&origin=inward",3,"2024-06-23 22:52:58","Article","10.32604/cmc.2023.046711","1546-2218","https://api.elsevier.com/content/abstract/scopus_id/85185834102",78,2,1933,1956,1,1.00,1,1,1,"","",""
0,"B. Alshouha","An integrated decision framework for evaluating and recommending health care services",2024,"Applied Intelligence","","","https://www.scopus.com/inward/citedby.uri?partnerID=HzOxMe3b&scp=85188243618&origin=inward",5,"2024-06-23 22:52:58","Article","10.1007/s10489-024-05396-z","0924-669X","https://api.elsevier.com/content/abstract/scopus_id/85188243618",54,5,4153,4171,0,0.00,0,1,1,"","",""
0,"B. Alshouha","BioEmoDetector: A flexible platform for detecting emotions from health narratives",2024,"SoftwareX","","https://api.elsevier.com/content/article/eid/1-s2.0-S2352711024000414","https://www.scopus.com/inward/citedby.uri?partnerID=HzOxMe3b&scp=85185833053&origin=inward",6,"2024-06-23 22:52:58","Article","10.1016/j.softx.2024.101670","2352-7110","https://api.elsevier.com/content/abstract/scopus_id/85185833053",26,,,,0,0.00,0,1,1,"","",""
1,"J. Serrano-Guerrero","Affective Knowledge-enhanced Emotion Detection in Arabic Language: A Comparative Study",2022,"Journal of Universal Computer Science","","","https://www.scopus.com/inward/citedby.uri?partnerID=HzOxMe3b&scp=85139927351&origin=inward",4,"2024-06-23 22:52:58","Article","10.3897/jucs.72590","0948-695X","https://api.elsevier.com/content/abstract/scopus_id/85139927351",28,7,733,757,1,0.50,1,1,2,"","",""
